{
  "schema_version": 1,
  "card": "TC-000",
  "gate": "P0_BOOTSTRAP",
  "generated_by": "gatecli",
  "generated_at": "2026-10-21T12:27:54Z",
  "base_rev": "b026c46ad0f6adbaa72e9091b1ef9e4d51e4ac05",
  "head_rev": "cb8c79debb38596ce03a82698468a43593f13698",
  "card_sha256": "df84c1ad7fa22913397589119b434ed48ffd9fee1fd91164fed90d2a81304d3c",
  "fingerprint": {
    "python": "3.13.15",
    "platform": "Windows-11-10.0.26200-SP0"
  },
  "scope": {
    "ok": true,
    "changed_paths": [
      "src/repo_presenter/__init__.py",
      "tests/conftest.py",
      "tests/test_version.py"
    ],
    "violations": []
  },
  "runs": [
    {
      "run": 1,
      "checks": [
        {
          "command": "python -m pytest tests/test_version.py -q",
          "exit_code": 0,
          "duration_s": 0.824,
          "stdout_sha256": "35d86279d96ed65491ba8ff0748e1c8e7891711531404dc5d4b9cd6ae33de3ec"
        }
      ],
      "all_passed": true
    },
    {
      "run": 2,
      "checks": [
        {
          "command": "python -m pytest tests/test_version.py -q",
          "exit_code": 0,
          "duration_s": 0.757,
          "stdout_sha256": "a71df3ef716cabe43ead70bd8311cda3aeadcb986bea501da0ea9262f31c3925"
        }
      ],
      "all_passed": true
    }
  ],
  "negative_control": {
    "kind": "mutate",
    "patch": "python -c \"import pathlib; p = pathlib.Path('src/repo_presenter/__init__.py'); s = p.read_text(encoding='utf-8'); q = chr(34); s2 = s.replace(q+'0.1.0'+q, q+q); p.write_text(s2, encoding='utf-8')\"",
    "patch_sha256": "8f9ba10f4705eb6aa5be054268a77c461d86b096ed7e88b0ac9807089f140471",
    "applied": true,
    "patch_applied_failed": true,
    "exit_codes": [
      1
    ],
    "tree_changed": [
      "M src/repo_presenter/__init__.py"
    ]
  },
  "accepted": true,
  "reason": "all gates passed"
}
